{
  "$schema": "../schema/code-sets.schema.json",
  "schemaVersion": 1,
  "note": "ICD-10 kod kumeleri. Eslestirme 'prefix' mantigiyla yapilir: girilen kod, kume icindeki bir kodla basliyorsa eslesir (C349 -> C34). 'extends' ile kume birlesimi kurulur, boylece ayni kod listesi tekrarlanmaz. status=active disindaki kodlar kabul edilir fakat sonucta uyari gosterilir.",
  "statusMeanings": {
    "active": "SUT metninden dogrulanmis, sorunsuz kullanilir.",
    "needs-review": "Kaynak veride bulundu fakat dogrulanamadi; kabul edilir, sonucta uyari cikar.",
    "proposed": "Ekip tarafindan eklenmesi onerildi; kabul edilir, sonucta uyari cikar."
  },
  "sets": [
    {
      "id": "tablo-1",
      "label": "SUT EK-2/B Tablo-1 - FDG PET/BT onkolojik tani listesi",
      "sutRef": "sut-ek-2b-tablo-1",
      "enforcement": "block",
      "rejectionMessage": "Girilen {code} kodu SUT Tablo-1 listesinde yer almiyor; F-18 FDG PET/BT bu tani ile odenmez.",
      "codes": [
        {
          "code": "C00",
          "label": "Dudak malign neoplazmi",
          "group": "Bas-boyun"
        },
        {
          "code": "C01",
          "label": "Dil kokunun malign neoplazmi",
          "group": "Bas-boyun"
        },
        {
          "code": "C02",
          "label": "Dilin diger ve tanimlanmamis kisimlari",
          "group": "Bas-boyun"
        },
        {
          "code": "C03",
          "label": "Dis eti malign neoplazmi",
          "group": "Bas-boyun"
        },
        {
          "code": "C04",
          "label": "Agiz tabani malign neoplazmi",
          "group": "Bas-boyun"
        },
        {
          "code": "C05",
          "label": "Damak malign neoplazmi",
          "group": "Bas-boyun"
        },
        {
          "code": "C06",
          "label": "Agzin diger ve tanimlanmamis kisimlari",
          "group": "Bas-boyun"
        },
        {
          "code": "C07",
          "label": "Parotis bezi malign neoplazmi",
          "group": "Bas-boyun"
        },
        {
          "code": "C08",
          "label": "Diger majör tukuruk bezleri malign neoplazmi",
          "group": "Bas-boyun"
        },
        {
          "code": "C09",
          "label": "Tonsil malign neoplazmi",
          "group": "Bas-boyun"
        },
        {
          "code": "C10",
          "label": "Orofarenks malign neoplazmi",
          "group": "Bas-boyun"
        },
        {
          "code": "C11",
          "label": "Nazofarenks malign neoplazmi",
          "group": "Bas-boyun"
        },
        {
          "code": "C12",
          "label": "Piriform sinus malign neoplazmi",
          "group": "Bas-boyun"
        },
        {
          "code": "C13",
          "label": "Hipofarenks malign neoplazmi",
          "group": "Bas-boyun"
        },
        {
          "code": "C14",
          "label": "Dudak, agiz ve farenkste diger bolgeler",
          "group": "Bas-boyun"
        },
        {
          "code": "C15",
          "label": "Ozofagus malign neoplazmi",
          "group": "Gastrointestinal"
        },
        {
          "code": "C16",
          "label": "Mide malign neoplazmi",
          "group": "Gastrointestinal"
        },
        {
          "code": "C17",
          "label": "Ince barsak malign neoplazmi",
          "group": "Gastrointestinal"
        },
        {
          "code": "C18",
          "label": "Kolon malign neoplazmi",
          "group": "Gastrointestinal"
        },
        {
          "code": "C19",
          "label": "Rektosigmoid bileske malign neoplazmi",
          "group": "Gastrointestinal"
        },
        {
          "code": "C20",
          "label": "Rektum malign neoplazmi",
          "group": "Gastrointestinal"
        },
        {
          "code": "C21",
          "label": "Anus ve anal kanal malign neoplazmi",
          "group": "Gastrointestinal"
        },
        {
          "code": "C22",
          "label": "Karaciger ve intrahepatik safra yollari",
          "group": "Hepatobiliyer"
        },
        {
          "code": "C23",
          "label": "Safra kesesi malign neoplazmi",
          "group": "Hepatobiliyer"
        },
        {
          "code": "C24",
          "label": "Diger ve tanimlanmamis safra yollari",
          "group": "Hepatobiliyer"
        },
        {
          "code": "C25",
          "label": "Pankreas malign neoplazmi",
          "group": "Hepatobiliyer"
        },
        {
          "code": "C26",
          "label": "Sindirim organlarinda diger/iyi tanimlanmamis bolgeler",
          "group": "Gastrointestinal"
        },
        {
          "code": "C32",
          "label": "Larenks malign neoplazmi",
          "group": "Bas-boyun"
        },
        {
          "code": "C34",
          "label": "Brons ve akciger malign neoplazmi",
          "group": "Toraks"
        },
        {
          "code": "C37",
          "label": "Timus malign neoplazmi",
          "group": "Toraks"
        },
        {
          "code": "C38",
          "label": "Kalp, mediasten ve plevra malign neoplazmi",
          "group": "Toraks"
        },
        {
          "code": "C40",
          "label": "Ekstremite kemik ve eklem kikirdagi",
          "group": "Kemik-yumusak doku"
        },
        {
          "code": "C41",
          "label": "Diger bolge kemik ve eklem kikirdagi",
          "group": "Kemik-yumusak doku"
        },
        {
          "code": "C43",
          "label": "Derinin malign melanomu",
          "group": "Deri"
        },
        {
          "code": "C45",
          "label": "Mezotelyoma",
          "group": "Toraks"
        },
        {
          "code": "C49",
          "label": "Diger bag ve yumusak doku malign neoplazmi",
          "group": "Kemik-yumusak doku"
        },
        {
          "code": "C50",
          "label": "Meme malign neoplazmi",
          "group": "Meme"
        },
        {
          "code": "C51",
          "label": "Vulva malign neoplazmi",
          "group": "Jinekolojik"
        },
        {
          "code": "C52",
          "label": "Vajina malign neoplazmi",
          "group": "Jinekolojik"
        },
        {
          "code": "C53",
          "label": "Serviks uteri malign neoplazmi",
          "group": "Jinekolojik"
        },
        {
          "code": "C54",
          "label": "Korpus uteri malign neoplazmi",
          "group": "Jinekolojik"
        },
        {
          "code": "C55",
          "label": "Uterus malign neoplazmi, kisim belirtilmemis",
          "group": "Jinekolojik"
        },
        {
          "code": "C56",
          "label": "Over malign neoplazmi",
          "group": "Jinekolojik"
        },
        {
          "code": "C60",
          "label": "Penis malign neoplazmi",
          "group": "Uroonkoloji"
        },
        {
          "code": "C62",
          "label": "Testis malign neoplazmi",
          "group": "Uroonkoloji"
        },
        {
          "code": "C64",
          "label": "Bobrek malign neoplazmi (renal pelvis haric)",
          "group": "Uroonkoloji"
        },
        {
          "code": "C65",
          "label": "Renal pelvis malign neoplazmi",
          "group": "Uroonkoloji"
        },
        {
          "code": "C66",
          "label": "Ureter malign neoplazmi",
          "group": "Uroonkoloji"
        },
        {
          "code": "C67",
          "label": "Mesane malign neoplazmi",
          "group": "Uroonkoloji"
        },
        {
          "code": "C71",
          "label": "Beyin malign neoplazmi",
          "group": "Noroonkoloji"
        },
        {
          "code": "C73",
          "label": "Tiroid bezi malign neoplazmi",
          "group": "Endokrin"
        },
        {
          "code": "C74",
          "label": "Adrenal (surrenal) bez malign neoplazmi",
          "group": "Endokrin"
        },
        {
          "code": "C80",
          "label": "Primer bolgesi bilinmeyen malign neoplazm",
          "group": "Diger"
        },
        {
          "code": "C81",
          "label": "Hodgkin lenfoma",
          "group": "Hematoloji"
        },
        {
          "code": "C82",
          "label": "Folikuler lenfoma",
          "group": "Hematoloji"
        },
        {
          "code": "C83",
          "label": "Non-folikuler lenfoma",
          "group": "Hematoloji"
        },
        {
          "code": "C84",
          "label": "Matur T/NK hucreli lenfomalar",
          "group": "Hematoloji"
        },
        {
          "code": "C85",
          "label": "Non-Hodgkin lenfoma, diger ve tanimlanmamis tipler",
          "group": "Hematoloji"
        },
        {
          "code": "C90",
          "label": "Multipl myelom ve malign plazma hucreli neoplazmlar",
          "group": "Hematoloji"
        },
        {
          "code": "D48",
          "label": "Diger/tanimlanmamis bolgelerin belirsiz davranisli neoplazmi",
          "group": "Diger"
        },
        {
          "code": "M95",
          "label": "(Dogrulanmamis) ICD-10'da M95 kas-iskelet sistemi deformitesi kodudur",
          "group": "Dogrulanmali",
          "status": "needs-review",
          "reviewNote": "Kaynak uygulamanin kod listesinde yer aliyordu fakat M95 onkolojik bir kod degil. Muhtemelen veri giris hatasi (C95/C96 olabilir). SUT Tablo-1 metniyle karsilastirilip ya duzeltilmeli ya da cikarilmalidir. Bkz. docs/duzeltmeler.md#acik-konular"
        }
      ]
    },
    {
      "id": "naf-onkolojik",
      "label": "F-18 NaF kemik PET/BT icin gecerli onkolojik tanilar",
      "sutRef": "sut-2.4.4.I",
      "extends": [
        "tablo-1"
      ],
      "enforcement": "block",
      "rejectionMessage": "Girilen {code} kodu kemik PET/BT icin gecerli bir onkolojik tani olarak tanimli degil.",
      "codes": [
        {
          "code": "C61",
          "label": "Prostat malign neoplazmi",
          "group": "Uroonkoloji",
          "status": "proposed",